{
    "metadata": {
        "formVersion": 1,
        "formTitle": "CEYLINCO LIFE",
        "formDescription": "Ceylinco Life Insurance Limited Ceylinco Life Insurance Limited, Ceylinco Life Tower, 106 Havelock Road, Colombo.05, Co. Reg: PB5183 Tel:(011)2461461 Email: service@ceylife.lk Web: www.ceylincolife.com.",
        "availableLocales": [
            "en",
            "si",
            "ta"
        ],
        "otpRequired": true
    },
    "prefilledFields": [
        "field1",
        "field2"
    ],
    "submission": {
        "endpoint": "/api/forms/occupation-clause",
        "method": "POST",
        "requiresAccessToken": true
    },
    "fields": {
        "ProposerName": {
            "type": "text",
            "label": "Proposer's Name",
            "required": true,
            "placeholder": "Proposer's Name",
            "description": "Proposer's Name",
            "defaultValue": ""
        },
        "contractNumber": {
            "type": "text",
            "label": "Contract Number",
            "required": true,
            "placeholder": "Contract Number",
            "description": "Contract Number",
            "defaultValue": ""
        },
        "nicNumber": {
            "type": "text",
            "label": "NIC Number",
            "required": true,
            "placeholder": "Enter NIC Number",
            "defaultValue": ""
        },
        "date": {
            "type": "date",
            "label": "Date",
            "required": true,
            "placeholder": "Date",
            "defaultValue": ""
        },
        "signature": {
            "type": "file",
            "label": "Signature",
            "required": true,
            "defaultValue": "",
            "fileOptions": {
                "maxFileSize": 10485760,
                "allowedExtensions": [
                    ".png",
                    ".jpg",
                    ".jpeg",
                    ".pdf"
                ]
            }
        }
    },
    "layout": [
        {
            "field": "ProposerName"
        },
        {
            "field": "contractNumber"
        },
        {
            "field": "nicNumber"
        },
        {
            "h1": "Occupation Clause"
        },
        {
            "text": "It is hereby declared and agreed, that if the Life Assured / Spouse Assured meets with an accident whilst being engaged in his usual occupation as indicated in the Proposal Form or Declaration of Good Health, the Company will not be liable to pay the supplementary benefits under the Policy, viz. Jeewayathra Accidental Death Benefit, Jeewayathra Monthly Income Benefit, Jeewayathra Partial and Permanent Disability Benefit."
        },
        {
            "text": "Consent"
        },
        {
            "text": "I have read and understood the afore-said clause and hereby give my consent to accept the Life Assurance proposal subject to respective clause."
        },
        {
            "field": "date"
        },
        {
            "field": "signature"
        }
    ],
    "localization": {
        "en": {},
        "si": {},
        "ta": {}
    }
}